{
  "anatomy_plausibility": {
    "checks": [
      {
        "name": "label_map_present",
        "reason": "loaded <repo>/runs/totalsegmentator_quality_source_pass/predicted_seg.nii.gz",
        "status": "pass"
      },
      {
        "name": "any_class_present",
        "reason": "label_ids_present=[1, 2, 3, 5]",
        "status": "pass"
      },
      {
        "failing": [],
        "name": "all_classes_within_volume_bounds",
        "reason": "all per-class volumes within population bounds",
        "status": "pass"
      },
      {
        "failing": [],
        "name": "no_fragmented_classes",
        "reason": "no class exceeds CC cap or fails largest-CC fraction",
        "status": "pass"
      },
      {
        "name": "liver_gt_spleen",
        "reason": "liver=1500.0 mL > spleen=200.0 mL",
        "status": "pass"
      },
      {
        "name": "bilateral_symmetry",
        "reason": "worst relative_diff=0.000 <= 0.5",
        "status": "pass"
      }
    ],
    "classes_failing_volume_bounds": [],
    "classes_overfragmented": [],
    "cross_class": {
      "bilateral_symmetry": {
        "pairs": [
          {
            "label_ids": [
              2,
              3
            ],
            "names": [
              "kidney_right",
              "kidney_left"
            ],
            "ok": true,
            "relative_diff": 0.0,
            "volumes_ml": [
              150.0,
              150.0
            ]
          }
        ],
        "reason": "worst relative_diff=0.000 <= 0.5",
        "relative_diff": 0.0,
        "status": "pass"
      },
      "liver_gt_spleen": {
        "liver_volume_ml": 1500.0,
        "reason": "liver=1500.0 mL > spleen=200.0 mL",
        "spleen_volume_ml": 200.0,
        "status": "pass"
      }
    },
    "per_class": [
      {
        "bounds": {
          "bilateral": false,
          "largest_cc_fraction_min": 0.85,
          "max_components": 1,
          "name": "spleen",
          "volume_ml_max": 500.0,
          "volume_ml_min": 30.0
        },
        "component_count": 1,
        "components_ok": true,
        "label_id": 1,
        "largest_cc_fraction": 1.0,
        "largest_cc_fraction_ok": true,
        "name": "spleen",
        "volume_bounds_ok": true,
        "volume_ml": 200.0,
        "voxel_count": 25000
      },
      {
        "bounds": {
          "bilateral": true,
          "bilateral_partner_id": 3,
          "largest_cc_fraction_min": 0.85,
          "max_components": 1,
          "name": "kidney_right",
          "volume_ml_max": 300.0,
          "volume_ml_min": 80.0
        },
        "component_count": 1,
        "components_ok": true,
        "label_id": 2,
        "largest_cc_fraction": 1.0,
        "largest_cc_fraction_ok": true,
        "name": "kidney_right",
        "volume_bounds_ok": true,
        "volume_ml": 150.0,
        "voxel_count": 18750
      },
      {
        "bounds": {
          "bilateral": true,
          "bilateral_partner_id": 2,
          "largest_cc_fraction_min": 0.85,
          "max_components": 1,
          "name": "kidney_left",
          "volume_ml_max": 300.0,
          "volume_ml_min": 80.0
        },
        "component_count": 1,
        "components_ok": true,
        "label_id": 3,
        "largest_cc_fraction": 1.0,
        "largest_cc_fraction_ok": true,
        "name": "kidney_left",
        "volume_bounds_ok": true,
        "volume_ml": 150.0,
        "voxel_count": 18750
      },
      {
        "bounds": {
          "bilateral": false,
          "largest_cc_fraction_min": 0.85,
          "max_components": 1,
          "name": "liver",
          "volume_ml_max": 2500.0,
          "volume_ml_min": 800.0
        },
        "component_count": 1,
        "components_ok": true,
        "label_id": 5,
        "largest_cc_fraction": 1.0,
        "largest_cc_fraction_ok": true,
        "name": "liver",
        "volume_bounds_ok": true,
        "volume_ml": 1500.0,
        "voxel_count": 187500
      }
    ],
    "verdict": "pass"
  },
  "artifact_inventory": {
    "affine_match": true,
    "label_map_dtype": "int16",
    "label_map_path": "<repo>/runs/totalsegmentator_quality_source_pass/predicted_seg.nii.gz",
    "label_map_readable": true,
    "label_map_shape": [
      120,
      100,
      60
    ],
    "shape_match": true,
    "voxel_volume_ml": 0.008
  },
  "gt_metrics": {
    "acceptable": true,
    "checks": [],
    "ground_truth_path": null,
    "per_class": [],
    "reason": "no ground_truth_path recorded in evidence pack",
    "verdict": "skipped"
  },
  "label_set_subset": {
    "extras": [],
    "missing": [],
    "present": [
      1,
      2,
      3,
      5
    ],
    "reason": "output.label_prompts_requested is empty or missing",
    "requested": [],
    "tolerance": 0,
    "verdict": "skipped"
  },
  "overall": "pass",
  "target": {
    "evidence_pack": "<repo>/runs/totalsegmentator_quality_source_pass",
    "ground_truth_path": null,
    "label_map_path": "<repo>/runs/totalsegmentator_quality_source_pass/predicted_seg.nii.gz",
    "skill_id": "totalsegmentator",
    "source_overall_status": "passed"
  },
  "verifier": {
    "id": "medagent.verifiers.totalsegmentator_quality_v1",
    "version": "0.1.0"
  }
}